{
  "$schema": "https://fujimod.com/schemas/progress.generated.schema.json",
  "schema": 1,
  "firmware_id": "xa1-150",
  "model": "X-A1",
  "version": "1.50",
  "stages": {
    "analysis": "not-run",
    "rec": "pass",
    "menu": "pass",
    "camera-identity": "not-run",
    "camera-snapshot": "not-run",
    "camera-menu": "not-run",
    "mod-target": "not-run",
    "mod-build": "not-run",
    "sd-image": "not-run"
  },
  "mods": {
    "af": "not-run",
    "fujimod": "not-run",
    "aspect-ratio": "not-run",
    "surround-view": "not-run",
    "desqueeze": "not-run",
    "desqueeze-jpeg": "not-run",
    "jpeg-max": "not-run",
    "framing-guideline": "not-run",
    "film-sims": "not-run",
    "card-films": "not-run",
    "film-editor": "not-run",
    "highlight-meter": "not-run",
    "raw-view": "not-run",
    "raw-exposure": "not-run",
    "hdmi-rec": "not-run",
    "controls": "not-run",
    "menu-theme": "not-run",
    "recipes": "not-run",
    "snap-focus": "not-run",
    "usb-debug": "not-run",
    "af-scene-capture": "not-run",
    "bug-report": "not-run",
    "sd-volume-name": "not-run",
    "date-folders": "not-run"
  }
}
